question,document Id,Answer Sentence
What was the capital of the Safavid Dynasty?,400.txt,"By the 1500s, Ismail I from Ardabil, established the Safavid Dynasty, with Tabriz as the capital."
"What Proto-Indo-European term means ""skillful assembler?",400.txt,"The Middle Iranian rn and aryn are oblique plural forms of gentilic r- (Middle Persian) and ary- (Parthian), both deriving from Proto-Iranian *arya- (meaning ""Aryan,"" i.e., ""of the Iranians""), argued to descend from Proto-Indo-European *ar-yo-, meaning ""skillful assembler."""
When was Reza Shah forced to abdicate in Iran?,400.txt,"In 1935, Reza Shah requested the international community to refer to the country by its native name, Iran."
Who found the Archaemenid Empire in 550 BC?,400.txt,"In 550 BC, Cyrus the Great, son of Mandane and Cambyses I, took over the Median Empire, and founded the Achaemenid Empire by unifying other city states."
Who triggered the Persian Revolt?,400.txt,The conquest of Media was a result of what is called the Persian Revolt.
What Empire neighbored and had a rivalry with Safavid Iran?,400.txt,"The centuries-long geopolitical and ideological rivalry between Safavid Iran and the neighboring Ottoman Empire, led to numerous OttomanPersian Wars."
